{
  "date": "2026-05-13",
  "user_query": "帮我查一下 GPT-image-2 有没有机会，我想看看要不要做相关工具站。",
  "trigger_reason_type": "fomo",
  "trigger_reason_note": "看到新图像模型和工具站机会，担心错过 SEO 或产品窗口。",
  "decision_context": "是否围绕 GPT-image-2 做相关页面或工具站，并投入开发或内容成本。",
  "default_action": "continue_research",
  "final_status": "probe",
  "key_evidence": "公开证据能降低技术可行性不确定性，但搜索需求、转化意图和用户愿付仍不能由公开搜索直接证明。",
  "next_action": "先做轻量对比页或榜单页，加体验按钮或等候名单，不直接开发完整工具站。",
  "insight": "用户可能容易把新模型热度快速联想到工具站机会，但真正改变行动的是搜索意图和低成本转化信号。",
  "confidence": "medium"
}
